{
  "title": "La minute Copilot",
  "subtitle": "Les modèles Copilot Web — Lequel choisir?",
  "author": "Martin Fournier",
  "date": "2026-05-17",
  "slides": [
    {
      "type": "title",
      "title": "La minute Copilot",
      "subtitle": "Les modèles Copilot Web",
      "footer": "Auto · Quick Response · Think Deeper · Pour IT et non-IT · Institution financière",
      "speaker_notes": "Accueil: «Vous avez peut-être remarqué que Copilot propose plusieurs modes. Auto, Quick Response, Think Deeper... On démystifie ça en 5 minutes!»"
    },
    {
      "type": "tips",
      "title": "Les 3 modes de Copilot Web",
      "subtitle": "Le sélecteur en haut de votre écran — un outil, trois façons de penser",
      "speaker_notes": "Montrer l'interface Copilot. Expliquer les 3 modes simplement. AUTO = le mode par défaut, Copilot choisit pour vous. QUICK = pour les questions rapides, réponse en secondes. THINK DEEPER = pour les problèmes complexes qui méritent une réflexion approfondie. Insister: la plupart du temps, Auto fait le bon choix à votre place.",
      "bullets": [
        "Auto (par défaut) → Copilot choisit le meilleur modèle selon la tâche",
        "Quick Response → Réponse en quelques secondes, idéal pour tâches simples",
        "Think Deeper → Raisonnement approfondi, pour problèmes complexes (30–90 s)"
      ],
      "cards": [
        {
          "title": "Auto (recommandé)",
          "color": "blue",
          "lines": [
            "Le choix par défaut",
            "",
            "Copilot délègue au bon",
            "modèle selon la",
            "complexité de votre",
            "demande",
            "",
            "Meilleur choix",
            "dans la grande",
            "majorité des cas"
          ],
          "icon": "sparkles"
        },
        {
          "title": "Quick Response",
          "color": "green",
          "lines": [
            "Réponse en quelques",
            "secondes",
            "",
            "Idéal pour:",
            "courriels, résumés,",
            "questions rapides,",
            "reformulations",
            "",
            "Vitesse avant tout"
          ],
          "icon": "zap"
        },
        {
          "title": "Think Deeper",
          "color": "amber",
          "lines": [
            "Réponse en 30–90 s",
            "",
            "Idéal pour:",
            "analyse de risques,",
            "conformité, code,",
            "décisions complexes",
            "",
            "Précision avant vitesse"
          ],
          "icon": "brain"
        }
      ]
    },
    {
      "type": "tips",
      "title": "Le bon mode pour le bon moment",
      "subtitle": "Exemples concrets en institution financière",
      "speaker_notes": "Adapter au contexte financier. Expliquer pourquoi Think Deeper est crucial pour l'analyse de risques mais inutile pour un courriel. Insister: mauvais choix de mode = perte de temps. Quick Response pour un rapport de conformité = risque d'erreur. Think Deeper pour un courriel = attente de 60 secondes sans raison. Auto gère ça pour vous.",
      "bullets": [
        "Quick Response: tâches simples et rapides — courriels, résumés, recherches",
        "Think Deeper: analyse, conformité, code complexe — la précision vaut l'attente",
        "Auto: laissez Copilot décider — il choisit bien dans la grande majorité des cas"
      ],
      "cards": [
        {
          "title": "Quick Response",
          "color": "green",
          "lines": [
            "Répondre à un courriel",
            "Résumer un fil Teams",
            "Rédiger un document",
            "Chercher une information",
            "",
            "Quand vous voulez",
            "une réponse vite"
          ],
          "icon": "zap"
        },
        {
          "title": "Think Deeper",
          "color": "amber",
          "lines": [
            "Analyser des données",
            "Écrire du code complexe",
            "Évaluer la conformité",
            "Analyse de risques",
            "",
            "Quand la précision",
            "prime sur la vitesse"
          ],
          "icon": "brain"
        },
        {
          "title": "Attention: mauvais mode",
          "color": "red",
          "lines": [
            "Think Deeper pour un",
            "courriel simple = 60 s",
            "d'attente inutile",
            "",
            "Quick Response pour",
            "une analyse de risques",
            "= résultat peu fiable",
            "",
            "Auto évite ces pièges"
          ],
          "icon": "triangle-alert"
        }
      ]
    },
    {
      "type": "bonus",
      "title": "Trucs et astuces",
      "subtitle": "Comment tirer le meilleur de chaque mode",
      "speaker_notes": "Rappeler que le mode est persistant — si vous passez en Think Deeper, il reste pour la session. Pensez à vérifier avant de commencer! Aussi: les prompts longs et détaillés bénéficient plus du Think Deeper. Pour la conformité, le Think Deeper est plus fiable car il raisonne plus longtemps. Astuce de pro: en mode Think Deeper, ajoutez un persona (chef de projet, auditeur interne) pour des résultats encore plus ciblés.",
      "bullets": [
        "Le mode choisi est conservé entre les sessions — vérifiez avant de commencer!",
        "Les prompts longs et détaillés bénéficient davantage du Think Deeper",
        "Pour les questions de conformité: Think Deeper = réponse plus rigoureuse",
        "Combinez Think Deeper + un persona pour des analyses encore plus précises"
      ],
      "cards": [
        {
          "title": "Astuce 1 — Vérifiez le mode",
          "color": "blue",
          "lines": [
            "Le mode reste actif",
            "d'une session à l'autre.",
            "",
            "Avant de commencer,",
            "regardez quel mode",
            "est sélectionné en haut",
            "de votre écran Copilot."
          ],
          "icon": "eye"
        },
        {
          "title": "Astuce 2 — Conformité",
          "color": "green",
          "lines": [
            "En institution financière,",
            "utilisez Think Deeper",
            "pour toute analyse",
            "impliquant conformité",
            "ou données sensibles.",
            "",
            "La rigueur vaut l'attente."
          ],
          "icon": "shield-check"
        },
        {
          "title": "Astuce 3 — Combo gagnant",
          "color": "amber",
          "lines": [
            "Think Deeper +",
            "persona expert =",
            "analyse de qualité",
            "professionnelle",
            "",
            "Ex: Think Deeper +",
            "«auditeur interne»"
          ],
          "icon": "lightbulb"
        }
      ]
    },
    {
      "type": "summary",
      "title": "À retenir — Les modes Copilot",
      "speaker_notes": "Résumé: Auto par défaut, Quick pour la vitesse, Think Deeper pour la profondeur et la conformité. Le piège à éviter: le mauvais mode fait perdre du temps ou donne des résultats peu fiables. Défi de la semaine: essayer Think Deeper sur une tâche d'analyse ou de conformité — noter la différence de qualité.",
      "cards": [
        {
          "title": "Auto (défaut)",
          "desc": "Copilot choisit\npour vous",
          "icon": "sparkles"
        },
        {
          "title": "Quick Response",
          "desc": "Tâches simples\nRéponse en secondes",
          "icon": "zap"
        },
        {
          "title": "Think Deeper",
          "desc": "Analyse, conformité\n30–90 s. Ça vaut l'attente",
          "icon": "brain"
        }
      ],
      "bonus": "Défi: Essayez Think Deeper sur votre prochaine analyse de conformité ou de risques!",
      "footer": "La minute Copilot — À la semaine prochaine!"
    }
  ],
  "$schema": "https://github.com/martinfou/la-minute-copilot/schema/la-minute-copilot.schema.json"
}
