{
  "title": "La minute Copilot",
  "subtitle": "Copilot dans Outlook",
  "author": "Martin Fournier",
  "date": "2026-05-17",
  "slides": [
    {
      "type": "title",
      "title": "🤖 La minute Copilot",
      "subtitle": "Copilot dans Outlook",
      "footer": "3 astuces pour IT et non-IT  •  Sauvegarder ses prompts",
      "speaker_notes": "Accueil: «Bonjour à tous! Bienvenue à cette nouvelle minute Copilot. Aujourd'hui on va voir comment Copilot peut vous faire gagner du temps dans Outlook, même avec la version de base.»"
    },
    {
      "type": "tips",
      "title": "🧠 Astuce 1 — Résumer un fil de discussion",
      "subtitle": "Fini les longues lectures de 15 courriels",
      "speaker_notes": "Démo: Ouvrir un long fil Outlook. Montrer le bouton Copilot. Cliquer sur Summarize. Montrer le résumé avec les décisions et action items. Insister: «Plus besoin de tout lire!»",
      "bullets": [
        "Ouvrir un courriel dans un long fil",
        "Cliquer sur l'icône Copilot dans le ruban",
        "Choisir «Summarize» ou taper sa propre demande"
      ],
      "cards": [
        {
          "icon": "💬",
          "title": "Exemples de prompts",
          "color": "green",
          "lines": [
            "«Résume ce fil et liste les décisions prises»",
            "«Quelles sont les dates de livraison?»",
            "«Extrais les action items avec échéances»"
          ]
        },
        {
          "icon": "🎯",
          "title": "Qui? Pourquoi?",
          "color": "amber",
          "lines": [
            "👨‍💼 Gestionnaires: suivre plusieurs projets",
            "👩‍💻 IT: retour de congé → 50 courriels résumés",
            "👤 Non-IT: fils clients interminables"
          ]
        }
      ]
    },
    {
      "type": "tips",
      "title": "✍️ Astuce 2 — Rédiger une réponse en 2 clics",
      "subtitle": "Décrivez en 5 mots, Copilot écrit le reste",
      "speaker_notes": "Démo: Répondre à un courriel. Montrer l'icône Copilot dans la fenêtre de réponse. Taper: «Remercie Jean, confirme livraison vendredi». Montrer le résultat. Puis montrer l'ajustement de ton: «Make this more professional».",
      "bullets": [
        "Cliquer Reply → icône Copilot dans la fenêtre",
        "Taper ce qu'on veut dire en langage naturel",
        "Ajuster le ton: professional, friendly, concise"
      ],
      "cards": [
        {
          "icon": "🎨",
          "title": "💡 Ajustement de ton",
          "color": "green",
          "lines": [
            "«Make this more professional»",
            "«Make it friendlier»",
            "«Make it more concise»",
            "«Réécris en ton neutre»",
            "🎯 Pour tout le monde!"
          ]
        }
      ]
    },
    {
      "type": "tips",
      "title": "🎯 Astuce 3 — Prioriser sa boîte de réception",
      "subtitle": "Laissez Copilot trier vos 50+ courriels non lus",
      "speaker_notes": "Démo: Ouvrir le volet Copilot. Montrer le prompt. Expliquer que c'est utile le lundi matin ou après un congé. Mentionner qu'on peut aussi demander en français.",
      "bullets": [
        "Ouvrir le volet Copilot (icône dans le ruban à droite)",
        "Écrire: «Show me my most urgent unread emails from today»",
        "Copilot trie et explique pourquoi chaque courriel est prioritaire"
      ],
      "cards": [
        {
          "icon": "💬",
          "title": "Variations utiles",
          "color": "green",
          "lines": [
            "«Prioritize my emails this week»",
            "«Quels courriels nécessitent une action?»",
            "«Résume les courriels de mon gestionnaire»"
          ]
        },
        {
          "icon": "🎯",
          "title": "Scénarios gagnants",
          "color": "amber",
          "lines": [
            "Lundi matin: 50 courriels, 30 secondes",
            "Retour de vacances: tout savoir rapidement",
            "Fin de mois: ne rien oublier"
          ]
        }
      ]
    },
    {
      "type": "bonus",
      "title": "💾 Bonus — Sauvegarder ses prompts",
      "speaker_notes": "Astuce préférée! Les prompts Copilot ne se sauvegardent pas automatiquement. Avec Quick Parts, on les réutilise en un clic. Montrer la démo: créer un Quick Part, l'utiliser dans un nouveau courriel.",
      "bullets": [
        "Quick Parts: Insertion → Quick Parts → Save Selection",
        "OneNote: page de garde «Mes prompts Copilot»",
        "Copilot Lab: copilot.cloud.microsoft/prompts"
      ],
      "cards": [
        {
          "icon": "⭐",
          "title": "Quick Parts (recommandé)",
          "color": "blue",
          "lines": [
            "1. Nouveau courriel → tapez votre prompt",
            "2. Sélectionnez le texte",
            "3. Insertion → Quick Parts → Sauvegarder",
            "4. Nommez: «[CP] Résumer fil»",
            "",
            "✅ Pour réutiliser:",
            "Insertion → Quick Parts → votre prompt"
          ]
        },
        {
          "icon": "📄",
          "title": "OneNote ou Copilot Lab",
          "color": "green",
          "lines": [
            "📄 OneNote: page partagée",
            "«Mes prompts Copilot»",
            "",
            "🏪 Copilot Lab:",
            "copilot.cloud.microsoft/prompts",
            "Centaines de prompts officiels"
          ]
        }
      ]
    },
    {
      "type": "summary",
      "title": "🎯 Les 3 astuces + le bonus",
      "speaker_notes": "Récapitulation rapide. Encourager à essayer AU MOINS UNE astuce cette semaine. Rappeler le prochain rendez-vous!",
      "cards": [
        {
          "icon": "🧠",
          "title": "Résumer",
          "desc": "Fini les longs fils"
        },
        {
          "icon": "✍️",
          "title": "Rédiger",
          "desc": "5 mots → Copilot écrit"
        },
        {
          "icon": "🎯",
          "title": "Prioriser",
          "desc": "50 courriels triés en 30s"
        }
      ],
      "bonus": "💾 Sauvegardez vos prompts avec Quick Parts!",
      "footer": "La minute Copilot — À la semaine prochaine! 👋"
    }
  ],
  "$schema": "https://github.com/martinfou/la-minute-copilot/schema/la-minute-copilot.schema.json"
}
